,Filières,"Spétialitée,",description
27,GE_GE_TS,"Génie électrique option Electronique, Automatisme et Robotique","Le technicien spécialisé en Génie électrique option Electronique, Automatisme et Robotique exerce des activités d’études, de diagnostic, de conduite de projet/chantier, de réalisation, de mise en service et de maintenance. Il travaille dans des entreprises de différentes tailles réalisant, ou exploitant des systèmes électroniques, automatisés ou robotisés. Dans le cadre de ses activités, il est amené à maîtriser les aspects normatifs, réglementaires, de sécurité des personnes et des biens, de performance énergétique, de protection de l’environnement et du développement durable. Il doit également veiller au respect des règles de santé et de sécurité au travail, et intégrer les aspects de maitrise de coûts et de compétitivité."
28,GE_GE_TS,Génie électrique option Energies renouvelables Eoliennes,Le Technicien Spécialisé en Génie Electrique option Energies Renouvelables Eoliennes est un électricien spécialisé dans la mise en œuvre d’équipements produisant des énergies renouvelables éoliennes. Ses fonctions sont :<br>-La réalisation des études de préfaisabilité de l’énergie éolienne ;<br>-La préparation de la réalisation notamment avec une bonne planification des travaux d’installation des systèmes de production d’énergie éolienne ;<br>-La gestion des équipes ;<br>-La réalisation à travers la mise en place des installations éoliennes ;<br>-Le raccordement des installations éoliennes au réseau ;<br>-La réalisation des réglages et test pour la mise en service ;<br>-La maintenance de l’installation éolienne ;<br>-Le respect des normes et standards de qualité et de sécurité.<br
29,GE_GE_TS,Génie électrique option Energies renouvelables solaires,"Le Technicien Spécialisé en Génie électrique option Energies Renouvelables Solaires est un électricien spécialisé dans la mise en œuvre d’équipements produisant des énergies renouvelables Solaires, notamment le système solaire photovoltaïque et solaire thermique. Ses fonctions sont :<br>-La réalisation des études de préfaisabilité de l’énergie solaire ;<br>-La préparation de la réalisation notamment avec une bonne planification des travaux d’installation d’énergie renouvelable solaire ;<br>-La gestion des équipes ;<br>-La réalisation à travers la mise en place des installations solaires ;<br>-Le raccordement des installations solaires au réseau ;<br>-La réalisation des réglages et test pour la mise en service ;<br>-La maintenance de l’installation solaire ;<br>-Veiller au respect des normes et standards de qualité et de sécurité.<br"
30,GE_GE_TS,Génie électrique option Electromécanique des Systèmes Automatisés,"L'Electromécanicien des Systèmes Automatisés est un professionnel chargé de maintenir dans des conditions optimales le fonctionnement des systèmes automatisés d’une entreprise. Ce technicien spécialisé exerce son métier dans des entreprises de toutes tailles concevant, réalisant, ou exploitant des systèmes automatiques. Il est censé être spécialiste des installations électriques « intelligentes », qui intègrent les technologies numériques, communicantes et les objets connectés au service des enjeux de performance opérationnelle."
31,GE_GE_TS,Génie électrique option Mécatronique,"Le Technicien Spécialisé en génie électrique option Mécatronique intervient sur les équipements électroniques, électriques, électromécaniques, pneumatiques ou hydrauliques et notamment dans le câblage électrique des instruments de bord dans les secteurs aéronautique et automobile.<br>Il exerce son métier dans des entreprises spécialisées dans la fourniture de composants comportant une partie câblage électrique ou des cartes électroniques, ainsi que dans des entreprises aux activités industrielles diversifiées et disposant de matériel de production avec des parties électriques importantes. Il effectue des tâches polyvalentes dans le domaine de la production ou l’installation des composants électriques et électroniques. Il effectue des câblages, installe des connecteurs, soude des composants, gère et conduit des machines, contrôle les systèmes, assure la maintenance préventive, effectue des visites, mesure des grandeurs, établit des bons de travaux, saisie des données, établit des diagnostics, détecte des pannes, répare et change des organes, entretient les équipements électriques, réalise des études, fait du chiffrage, assemble des composants (électriques, électroniques, électromécaniques, hydrauliques, pneumatiques ...) et réalise des schémas électriques.<br>Il installe, vérifie, monte et fait des essais sur le produit. Quand il intervient sur les équipements de production, il opère plus précisément sur des armoires de commande, des moteurs, des automates programmables, des variateurs de vitesse, des valves, des pompes, des systèmes hydrauliques, des systèmes pneumatiques, des convoyeurs, des éléments de transmission, vérifie la conformité et le fonctionnement d'un équipement nouvellement installé, valide l’architecture d’un automatisme, ajuste ou étalonne des chaînes de régulation, programme des automates, apporte des modifications à la chaîne de production, participe à des arrêts de maintenance, etc."
32,MTI_GI_TS,Génie Industriel option Gestion de la maintenance,"La filière « Génie industriel option gestion de la maintenance » donne accès au métier d’un professionnel polyvalent chargé d’assurer la maintenance des équipements industriels, de production et de service.  <br>Les activités en maintenance industrielle intègrent également : <br>-L’amélioration de la sécurité des biens et des personnes ; <br>-L’amélioration de la disponibilité des moyens et son optimisation ; <br>-L’intégration de nouveaux biens dans le dispositif de production ou de service ; <br>-L’organisation des activités de maintenance ; <br>-L’animation et l’encadrement des équipes d’intervention. <br>-L’utilisation des moyens de gestion informatisés (GMAO et GPAO)<br"
33,MTI_GI_TS,Génie Industriel option Gestion de la production,"Le rôle du Technicien spécialisé en gestion de production est de garantir la fabrication selon les délais et la conformité demandée par le client tout en étant préoccupé par les coûts de fabrication. À cet effet, le technicien doit non seulement gérer un processus de production, mais également anticiper, prévoir et réagir adéquatement et promptement aux diverses situations qui se présentent.<br>La gestion de la production comporte la planification, l’organisation des ressources, la coordination des activités et du personnel ainsi que le contrôle du processus et des produits. L’exercice de ces fonctions nécessite un bon leadership d’influence, de l’autonomie, la capacité de résoudre des problèmes et la capacité de s’adapter à des situations évolutives au niveau technologique et organisationnel.<br"
34,GC_GE_TS,Gestion des Entreprises option Comptabilité et Finance,"Le Technicien Spécialisé en Gestion des Entreprises Option Comptabilité et Finance, au sein des services administratifs, comptables et financiers des entreprises, autres organisations, ou des cabinets comptables qui l'emploient :  <br>­<br>Organise et réalise la gestion des obligations comptables, fiscales et sociales ; <br>­<br>Analyser et justifier les comptes ;<br>­<br>Participe à l'élaboration et à la communication des informations financières et de gestion ;<br>­<br>Contribue aux prévisions et à la préparation des décisions.<br"
35,GC_GE_TS,Gestion des Entreprises option Commerce et Marketing,"Le Technicien Spécialisé en Gestion des Entreprises Option Commerce et Marketing a un rôle moteur dans la pérennité de l’entreprise. Sa mission principale est de porter l’image de l’entreprise et fidéliser ses clients. Il est capable de mener toute action commerciale nécessaire à l'atteinte des objectifs fixés allant de la négociation à la vente d’une prestation en assurant un bon suivi commercial. <br>Afin de bien mener une veille concurrentielle, le technicien doit avoir tous les outils lui permettant d’analyser le marché en vue d’anticiper les besoins de ses clients. Dans un contexte fortement concurrentiel, il doit également contribuer au déploiement d’une stratégie commerciale efficace. Qu’il s’agisse d’une activité de vente locale, nationale ou à l’échelle internationale, ses qualifications lui offrent une grande capacité d’adaptation à toute situation commerciale."
36,GC_GE_TS,Gestion des Entreprises option Office Manager,"Au sein d'une entreprise, le Technicien Spécialisé en Gestion des Entreprises Option Office Manager a pour mission essentielle d'assister le dirigeant de la structure et de le décharger de certaines de ses fonctions. Il est, en particulier, chargé de la gestion des opérations administratives et de la transmission des informations entre la direction et ses différents interlocuteurs internes (services, personnel) et externes (fournisseurs, banques...). Il rédige des synthèses et présente des rapports et des bilans. Selon la taille de l'entreprise qui l'emploie, il peut aussi prendre en charge la gestion du budget (élaboration et suivi), s'occuper de la comptabilité, planifier et veiller à la mise en œuvre des projets qu'il supervise. Ses fonctions l'amènent à connaître parfaitement chaque service de son entreprise et tous les rouages qui assurent son fonctionnement.<br"
37,GC_GE_TS,Gestion des Entreprises option Ressources Humaines,"Le Technicien Spécialisé en Gestion des Entreprises Option Ressources Humaines contribue à la mise en œuvre de la politique RH. Il est appelé à traiter soit partiellement, soit en totalité les données relatives de la gestion du personnel.<br>Ses activités principales :<br>-Assister le responsable dans les opérations de recrutement ;<br>-Participer à la gestion de la formation du personnel ;<br>-Etablir la paie du personnel ;<br>-Renseigner les formulaires de déclaration fiscale et sociale ;<br>-Participer au suivi administratif du personnel…<br"
